{
  "schema_version": "1.0.0",
  "task_id": "ACL-EXAMPLE-001",
  "gate": "benchmark-external",
  "evidence_kind": "vietnamese-meal-benchmark",
  "subject_commit": "da04e773a214e8f8232db149d1f35f3f0bd61ce1",
  "result": "pass",
  "artifact_ref": "https://example.invalid/evidence/artifact.json",
  "artifact_sha256": "0000000000000000000000000000000000000000000000000000000000000000",
  "issuer": "architect-approved-evaluator"
}
